{
  "schema_version": 1,
  "id": "synthetic-breakout",
  "name": "Synthetic Breakout Adapter",
  "mode": "diagnostic",
  "asset_classes": ["synthetic"],
  "owner": "the-pass",
  "providers": [
    {
      "id": "synthetic-fixture",
      "type": "synthetic",
      "license": "public-safe",
      "url": "",
      "fields": ["timestamp", "open", "high", "low", "close", "volume"],
      "limitations": ["No real market microstructure", "No evidence of tradable edge"]
    }
  ],
  "provider_review": {
    "license": "public-safe synthetic fixture",
    "redistribution": "fixture can be redistributed with the repository",
    "authentication": "none",
    "retention": "tracked fixture data only",
    "deterministic_replay": true,
    "limitations": ["No real market data", "No provider outage model"]
  },
  "engine": {
    "name": "none",
    "role": "fixture-only",
    "limitations": ["No execution engine"]
  },
  "policies": {
    "timestamp": "Single synthetic timestamp; no receive-time latency model",
    "cost_model": "Fixed illustrative cost only",
    "fill_model": "No fills; diagnostic package only",
    "risk_model": "No capital at risk",
    "settlement": "Not applicable"
  },
  "safety": {
    "live_trading_enabled": false,
    "real_order_path_available": false,
    "credentials_required": false
  }
}
